{
	"id": "enaml.studio.core",
	"name": "Enaml Studio Core",
	"description": "The Enaml studio core plugin.",
	"class": "enaml.studio.core.core_plugin.CorePlugin",
	"extensionPoints": [
		{
			"id": "uriReaders",
			"name": "URI Readers",
			"description": "URI readers are used to load data from a uri.",
			"interface": "enaml.studio.core.uri_reader.URIReader"
		}
	],
	"extensions": [
		{
			"id": "defaultFileReader",
			"point": "enaml.studio.core.uriReaders",
			"name": "Default File Reader",
			"description": "The default uri reader for the local filesystem.",
			"class": "enaml.studio.core.file_reader.FileReader",
			"scheme": "file",
			"rank": -1000
		}
	]
}
